{
  "id": "kingsmith-walkingpad-p1",
  "make": "KingSmith",
  "model": "WalkingPad P1",
  "fitOscData": {
    "driver": ["WALKINGPAD"]
  },
  "vrtiData": {
    "experimental": false,
    "driver": ["KINGSMITH_FE00"]
  },
  "source": {
    "name": "KingSmith Official Store",
    "url": "https://www.kingsmith.com/products/king-smith-p1-foldable-walking-pad"
  },
  "features": ["speedControl", "steps"],
  "vendorApps": [
    {
      "name": "KSFit",
      "supported": true,
      "notes": []
    }
  ],
  "sharedNotes": []
}
