{
  "id": "kingsmith-walkingpad-a1-pro",
  "make": "KingSmith",
  "model": "WalkingPad A1 PRO",
  "fitOscData": {
    "driver": ["WALKINGPAD"]
  },
  "vrtiData": {
    "experimental": false,
    "driver": ["KINGSMITH_FE00"]
  },
  "weight": {
    "maxUser": 300,
    "unit": "lb"
  },
  "source": {
    "name": "KingSmith Official Store",
    "url": "https://www.kingsmith.com/products/kingsmith-a1-pro-foldable-walking-pad"
  },
  "features": ["speedControl", "steps"],
  "vendorApps": [
    {
      "name": "KSFit",
      "supported": true,
      "notes": []
    }
  ],
  "sharedNotes": ["FootSense automatic speed control"]
}
