{
  "id": "kingsmith-g15",
  "make": "KingSmith",
  "model": "G15",
  "fitOscData": {
    "driver": []
  },
  "vrtiData": {
    "experimental": false,
    "driver": ["FTMS_KINGSMITH_G15"]
  },
  "weight": {
    "maxUser": 136,
    "unit": "kg"
  },
  "source": {
    "name": "Amazon UAE",
    "url": "https://www.amazon.ae/KINGSMITH-Electric-Treadmill-Real-Time-Tracking/dp/B0FH6CRWKZ"
  },
  "features": ["speedControl"],
  "vendorApps": [
    {
      "name": "KSFit",
      "supported": true,
      "notes": []
    }
  ],
  "sharedNotes": []
}
