{
  "id": "kingsmith-walkingpad-r1-pro",
  "make": "KingSmith",
  "model": "WalkingPad R1 PRO",
  "fitOscData": {
    "driver": ["WALKINGPAD"]
  },
  "vrtiData": {
    "experimental": false,
    "driver": ["KINGSMITH_FE00"]
  },
  "source": {
    "name": "KingSmith Official Store",
    "url": "https://www.kingsmith.com/products/king-smith-r1-pro-2in1-foldable-treadmill"
  },
  "features": ["speedControl", "steps"],
  "vendorApps": [
    {
      "name": "KSFit",
      "supported": true,
      "notes": []
    }
  ],
  "sharedNotes": [
    "When the bar is not extended, the R1 Pro limits its speed to 6km/h."
  ]
}
