{
  "id": "urevo-spacewalk-e1l",
  "make": "UREVO",
  "model": "SpaceWalk E1L",
  "fitOscData": {
    "driver": ["GENERIC"]
  },
  "vrtiData": {
    "experimental": false,
    "driver": ["FTMS"]
  },
  "weight": {
    "maxUser": 242,
    "unit": "lb"
  },
  "source": {
    "name": "UREVO Official Store",
    "url": "https://www.urevo.com/products/urevo-spacewalk-e1l-treadmill"
  },
  "features": ["speedControl"],
  "vendorApps": [
    {
      "name": "URevo",
      "supported": true,
      "notes": []
    }
  ],
  "sharedNotes": []
}
