{
  "id": "kingsmith-walkingpad-x21",
  "make": "KingSmith",
  "model": "WalkingPad X21",
  "fitOscData": {
    "driver": []
  },
  "vrtiData": {
    "experimental": false,
    "driver": ["KINGSMITH_1234"]
  },
  "source": {
    "name": "KingSmith Official Store",
    "url": "https://www.walkingpad.com/products/walkingpad-x21-foldable-treadmill"
  },
  "features": ["speedControl", "steps"],
  "vendorApps": [
    {
      "name": "KSFit",
      "supported": true,
      "notes": []
    }
  ],
  "sharedNotes": []
}
