{
  "id": "kalwol-x382p",
  "make": "KALWOL",
  "model": "X382P",
  "fitOscData": {
    "driver": []
  },
  "vrtiData": {
    "experimental": false,
    "driver": ["FTMS"]
  },
  "weight": {
    "maxUser": 350,
    "unit": "lb"
  },
  "source": {
    "name": "Amazon.ca",
    "url": "https://www.amazon.ca/dp/B0FX9X68TJ"
  },
  "features": ["speedControl", "steps"],
  "vendorApps": [
    {
      "name": "FitShow",
      "supported": true
    },
    {
      "name": "Kinomap",
      "supported": true
    },
    {
      "name": "Zwift",
      "supported": true
    }
  ],
  "sharedNotes": []
}
