{
  "id": "dynamax-runningpad",
  "make": "Dynamax",
  "model": "RunningPad (DYCV-10221)",
  "fitOscData": {
    "driver": ["WALKINGPAD"]
  },
  "vrtiData": {
    "experimental": false,
    "driver": ["KINGSMITH_FE00"]
  },
  "weight": {
    "maxUser": 110,
    "unit": "kg"
  },
  "source": {
    "name": "Dynamax Official Store",
    "url": "https://www.dynamax-fitness.com/runningpad"
  },
  "features": ["speedControl"],
  "vendorApps": [
    {
      "name": "KSFit",
      "supported": true,
      "notes": []
    }
  ],
  "sharedNotes": []
}
