{
  "id": "kingsmith-walkingpad-z1d",
  "make": "KingSmith",
  "model": "WalkingPad Z1D",
  "fitOscData": {
    "driver": ["GENERIC"]
  },
  "vrtiData": {
    "experimental": false,
    "driver": ["FTMS"]
  },
  "weight": {
    "maxUser": 243,
    "unit": "lb"
  },
  "source": {
    "name": "KingSmith Official Store",
    "url": "https://www.kingsmith.com/products/walkingpad-z1-foldable-walking-pad"
  },
  "features": ["speedControl"],
  "vendorApps": [
    {
      "name": "KSFit",
      "supported": true,
      "notes": []
    }
  ],
  "sharedNotes": []
}
