{
  "id": "urevo-spacewalk-e4w",
  "make": "UREVO",
  "model": "SpaceWalk E4W",
  "fitOscData": {
    "driver": ["GENERIC"]
  },
  "vrtiData": {
    "experimental": true,
    "driver": ["FTMS_UREVO_HYBRID"]
  },
  "weight": {
    "maxUser": 265,
    "unit": "lb"
  },
  "source": {
    "name": "UREVO Official Store",
    "url": "https://www.urevo.com/products/urevo-spacewalk-e4w-treadmill"
  },
  "features": ["speedControl"],
  "vendorApps": [
    {
      "name": "URevo",
      "supported": true,
      "notes": []
    }
  ],
  "sharedNotes": []
}
