{
  "id": "xterra-trx4500",
  "make": "XTERRA",
  "model": "TRX4500",
  "fitOscData": {
    "driver": ["GENERIC"]
  },
  "vrtiData": {
    "experimental": false,
    "driver": ["FTMS"]
  },
  "weight": {
    "maxUser": 350,
    "unit": "lb"
  },
  "source": {
    "name": "XTERRA Fitness Official Store",
    "url": "https://global.xterrafitness.com/product-page/trx4500"
  },
  "features": ["speedControl", "inclineControl", "heartRate"],
  "vendorApps": [
    {
      "name": "Kinomap",
      "supported": true,
      "notes": []
    },
    {
      "name": "Zwift",
      "supported": true,
      "notes": []
    }
  ],
  "sharedNotes": []
}
