{
  "id": "urevo-spacewalk-3s",
  "make": "UREVO",
  "model": "SpaceWalk 3S",
  "fitOscData": {
    "driver": ["GENERIC"]
  },
  "vrtiData": {
    "experimental": false,
    "driver": ["FTMS"]
  },
  "weight": {
    "maxUser": 265,
    "unit": "lb"
  },
  "source": {
    "name": "UREVO Official Store",
    "url": "https://www.urevo.com/products/spacewalk-3s-treadmill"
  },
  "features": ["speedControl", "inclineControl"],
  "vendorApps": [
    {
      "name": "URevo",
      "supported": true,
      "notes": []
    }
  ],
  "sharedNotes": []
}
