{
  "id": "urevo-strol-2e",
  "make": "UREVO",
  "model": "Strol 2E (URTM030)",
  "fitOscData": {
    "driver": ["GENERIC"]
  },
  "vrtiData": {
    "experimental": false,
    "driver": ["FTMS"]
  },
  "weight": {
    "maxUser": 265,
    "unit": "lb"
  },
  "source": {
    "name": "UREVO Official Store",
    "url": "https://www.urevo.com/products/strol-2e-treadmill"
  },
  "features": ["speedControl"],
  "vendorApps": [
    {
      "name": "URevo",
      "supported": true,
      "notes": []
    }
  ],
  "sharedNotes": []
}
